id,comment_id,parent_comment_id,user_id,parent_user_id,parent_content,content,support,parody
1260,lopr7bd,,978,,,Democrats burn down cities? Didn't they have to call the National Guard on Jan 6?,2,0
1035,looij0t,,769,,,As soon as one of her arguments had a logical question she froze. They can’t confront logical. It’s a hard rest to their brain and they get defensive and aggressive. She basically says that’s it patriotic to force her ideals on everyone…Merica,0,0
709,lot53on,lot366m,477,473.0,"Hadn't even thought about it until now. ""plsEndMe"" was taken, so I added 2. I guess I'm an accidental genius. hahaha","Hahaha that makes it twice as funny, fuck 😂",0,0
256,loqniwy,lomwis6,199,154.0,"Is it stolen valor if you claim your living father ""laid down his life for this country"" because he had a 30 year career in the military?  ","It’s interesting how she goes on about how republicans are talking about how they’re being selfless, but she hasn’t heard a democrat in the military try to use their service as “selfless.” In an argument.",1,0
883,loo2hn8,,634,,,Americans are so annoying wow,2,0
594,losrkf0,lonqeev,356,383.0,I for one like political Tom Holland,He's actually ripped as hell which I wasn't expecting. Bro has a total sleeper build,0,0
390,loot8o4,loorqq7,275,215.0,The video is literally “1 liberal vs 20 Trump supporters” I think it was understood by all who everyone in that room was for,"I know now, but this out take doesn't reflect that.",0,0
1281,lopwkjt,,996,,,"This was a hard clip to watch. The young lady talked fast in explaining her argument while forcing her interjection in effort to clarify her points, yet she never listened to The debater's counterpoint to her argument. And when her point was proven, her answer was ""I have no comment to that"".  That's weak and evidence of sticking to your points. Forget what the facts show.",2,0
1303,loq050e,,1014,,,That was painful to watch all the way through. I think I just lost some IQ points…,2,0
558,lor7zje,loqrpft,227,360.0,"Honestly, agreed. I hadn’t watched the actual video yet when I made my above comment, just a couple minutes in to get the rules and made an assumption.(my b 😅)  I’ve since watched the video (most of it at least: I had it playing in the background so def missed some of the fact checks that came up on screen) and it really felt like actual valid back and forth debate was flagged but the most brain dead arguments were allowed to stand as long as they just kept the liberal guy from speaking. And the people at the table *definitely* picked up on that right away",The vast majority of them wouldn't let him talk. The few that did got quickly voted out. It was pure stupidity. And then there was TRACEY. Lawd have mercy.,0,0
909,lonkic8,,656,,,Who is this guy? He is amazing!,1,0
925,lonurn5,,670,,,"She got got and knew it and fell back on the ""no comment"". What a dumbass.",0,0
1400,loqxbs8,,1098,,,"This woman & the other one he was having a “dialogue” with earlier fell off the stupid tree & hit every branch on the way down. 
There’s just so many things that are gravely erroneous about her accusations (such as Democrats support homelessness & drugs & other crap she said ) that it’ll be impossible to list them in a comment. I commend the guy for keeping his cool.",2,0
1008,loog0un,,744,,,"I feel like the whole “Biden won counties generate 70% of GDP and taxes, while majority of government spending goes to Trump won counties” should be on the list of Democrat Patriotism.",0,0
461,lopotql,lopo9ad,313,227.0,"Wait until you see Tracey. Lawd have mercy. SHE had no interest in actually having a dialogue, only in attempting to rile him up and explode so she could be like, omggggg, you're a bad person. He didn't take the bait though.","I just saw that one. My god, she made me angrier than anyone. She had ONE point to make and she wasn’t even entirely right about it. Insisting that it was ALL Biden’s idea, when the pulling from Afghanistan was actually started by trump based on the post-production fact check. Jesus Christ. Some of these people can’t understand that a debate is civil and requires turns to speak. Not just speaking over others.",0,0
724,lord8t4,,490,,,"Speaking at 200 mph, nonstop repeatedly asking the poor guy to answer her zillion questions. He starts, she interrupts consistently. She's got definite issues with self-control...",0,0
1042,loojbm2,,776,,,"For her to ask him a question and without giving him an opportunity to respond, and simply riding roughshod over him by giving her response in refutation of an answer he has not given, shows why this format is so flawed. That is how the majority of these individual sessions play out.",2,0
1506,loosvry,,1192,,,Just like my brother they never let you talk they are so afraid of any truth.,0,0
145,loold1i,lomnr3b,122,28.0,She spoke way too much and didn’t say a damn thing.,Kind of like Kamala Harris.,0,0
959,loo6c91,,700,,,She didn’t want a dialogue….she wanted to be right.,0,0
502,lomxq5x,lomr57c,212,325.0,He could have went a better way with the patriotic question in that Democrats have supported veterans unlike the Republicans.,"Or are veterans, along with a plethora of diverse political thought. To include communism and anarchism.

Unless we are going bad to the tried and true propaganda that says John Kerry is not a patriotic man despite his service and record of being wounded in combat. Or do these things only count when you already agree with their political ideology?",0,0
923,lonsz2o,,668,,,"I’ll see your burning the flag and buildings, and raise you an attempt to overthrow the government and constitution that your dad spent 30 years to protect.",0,0
1189,lop6mk4,,908,,,"It’s not patriotic to hate 70-80% of Americans the way MAGA does. 

They don’t believe the US is a good country so how exactly are they patriotic?",0,0
740,lonbwxh,,504,,,Watching this made me stupid....,2,0
1584,loufqzz,loue253,998,1216.0,"Charismatic 🤣🤣🤣
When he stood aside, voting should have happened to elect a candidate, she has never gotten a single vote for potus in primaries. Not one. 

That’s some bs. this race is so close that it can’t even be called and that’s all because they chose her. Any other candidate ( but Biden) would have had this in the bag by now.","Imagine watching that debate and claiming Harris isn’t charismatic 😂😂😂😂😂 truly insane

When he stepped aside there was delegate voting, which is how our democracy works. 

The only chance the Dems had of winning was with Harris. Any other candidate would have been flopping. No one else could have murdered Trump in that debate like she did",0,0
869,lorw7vr,,622,,,"Good Lord, she is insufferable.

Girl, lay off the caffeine.",2,0
732,lon4l70,lomy70g,360,496.0,Damn. Peter Parker’s clone brother Ben Reilly really taking it to conservatives. (I challenge you to say he doesn’t look like Tom Holland),I literally thought he was at first LOLLL 😂,1,0
540,losodb2,loq6ju2,231,353.0,"That’s almost exactly the point I’m making. But I would say there was marked difference with how the liberal group interacted with each other verse how the conservative group interacted. 

The liberals were running over each other and almost instantly putting their flags up to kick people out of the seat. 

The conservatives for the most part were quite respectful of each other even differing the seat at times and usually allowed the new debater to state their case before lifting the flag.

It was a very striking difference that is even more pronounced if you play each episode back on mute. I’m not even talking about the exact stances each group held just observing the way in which they interacted amongst themselves.",Yeah I immediately noticed that too. It was a stark contrast between the two sides lol,0,0
178,loow86x,lomq43g,145,123.0,Shes brutal to listen to,"I have scrolled by these thread the past few days because I knew if I turned the sound on and watched  I was going to hear a bunch of empty-headed nonsense.  I turned on the sound today and learned that only Republicans join the military and only Democrats live in and run cities with homeless and trash.

Confidently stupid people are so draining.",2,0
1576,loudte1,loudl9w,998,1216.0,Im from Latin America. You are insurrecting wrong 😑,Oh so the Bolsonaro insurrection inspired by the January 6th insurrection? 😑,0,0
698,loorhc7,,474,,,she really thinks she did something there. just keep talking so fast he can't answer anything. that'll show them how smart you are.,0,1
1520,loqrlnm,,600,,,Stupid libs 🤦‍♂️,2,0
1135,looyym6,,858,,,Liberals  too focused on the feelings and attitude to hear the facts 🤣🤣,1,0
1121,looxglz,,846,,,"She keeps saying ""let me clarify"" but clarifies nothing and just keeps ranting half truths and lies lmfao",0,0
1321,loq4olg,,1030,,,"This guy is fantastic to listen to, but I'm gonna have to pass on watching these videos. I am getting secondhand frustration from each individual he debates. They just interject and interrupt the entire time and constantly change the subject when he makes a point. It's wearing me out.",1,0
1627,lona327,lon4hns,412,393.0,"She’s good at talking, but everything she says is old—nothing new going on in her head.","She's expressive, but she's dogshit at arguing. Overly emotional and she can't wait to jump in and mock something. She also crutches heavily on having cheerleaders because she needs their energy to beat her opponent since her arguments aren't doing the job. Her whole thing here was ""haha ur so weird, friends cheer for me pls so he knows he's silly"".

And then she argued her way into a corner and couldn't get out of it. If she's giving off stereotypical ""head of the bully group"" in a Hollywood movie, it's because she probably wouldn't be too far from that portrayal. She argues like she knows people have her back, that's the problem.",0,0
8,los6nrd,loqonf8,8,7.0,"But the card said ""let's bee friends and there was a picture of a bee",Thank you,0,0
373,loscp6o,lonhbbi,266,257.0,So we're going back to the slavery thing? What straw man is this? What party supported slavery in the civil war again?,"The parties switched platforms in 1948, hope this helps: 

https://en.wikipedia.org/wiki/Party_switching_in_the_United_States",0,0
668,loo1s7r,,449,,,"Damn, she never shuts up.",2,0
1259,lopqv62,,977,,,This whole episode I watched last night and I really wish theyd show the Hispanic saying he can't be racist xD,0,0
1248,lopm1qs,,966,,,Both of these people are insufferable,2,0
358,lon19pf,lon0yh0,257,256.0,"Yes, white supremacists and fascism enjoyers 1,000% think differently than I do. We litigated their ideologies in the Civil War and World War II. They lost. Both times.

But you do you, boo.","The civil war was over slavery, wtf are you talking about, boo? No one saying they're gonna put ya'll back in chains here. To quote Joe Biden",2,0
968,loo8bhd,,708,,,I don’t care how many times people say it’s not Tom holland. This is a Tom Holland prank,0,0
784,loorcr0,,223,,,What are the red flags being held up and what is this event being filmed? I don’t understand exactly what’s going on other than she seems like a raving lunatic with no real points and a refusal to have a conversation who insist on talking over dude’s attempts to engage in discussion.,2,0
736,lonln0r,,500,,,My preacher say democrats bad,0,1
971,loo92j1,,711,,,"She talks like literally every single conservative I have ever known. Never let's you get in a word, and super snarky and condescending for literally no reason.",2,0
1247,loplnai,,965,,,I've got to get off reddit.  This place is making us all losers.,0,0
1212,lopcg53,,931,,,"Is this really what people think debate is? I mean they dont have great rolemodels in the politicians. But they dont listen and actually debate they subject, they just want to say what they have to say and be right",2,0
1302,lopzy1o,,1013,,,She had good points...🤷🏼,1,0
1390,loqrn7a,,1089,,,She big dumb.,2,0
1428,lorsa3a,,109,,,"The classic "" if I keep talking long enough, something is bound to be good"" strategy....

Ignored the statement from the word go, didn't address the questions and attacked, attacked attacked. The dude said "" i fully agree with you, however anyone supporting trump's documented attempts to overthrow democracy is less patriotic then anyone opposing him ' and she had NOTHING to say except"" it's not about trump "" , what is it about then? 😂😂",0,0
886,loos6vg,,637,,,She doesn’t actually want him to say anything. She just doesn’t stop,0,0
80,lon3x64,lomnr3b,67,28.0,She spoke way too much and didn’t say a damn thing.,Conservatives playbook,0,0
815,lopkz4u,,570,,,"First of all, the things she mentioned she believed were patriotic are actually nationalism. Whether you stand or kneel for the flag does not make you a patriotic. It’s your right to do either in a free country. You can burn the flag, too, in a country that still allows for freedom of expression. Just like she couldn't define socialism she couldn't define what it means to be a patriot. MAGA conflates nationalism with patriotism. Second, she had an issue with buildings being burned by democrats...I guess there was no issue with J6? These ppl are so ignorant and useless when it comes to good faith arguments it's maddening. Such a sad reflection on how much our country squanders. Access to education and information is totally squandered on mindless brainrot.",2,0
1055,lookd6h,,789,,,"She isn't accepting of any response. Her behavior is oppressive, rude, and unacceptable. But it is exactly what we see from average right wing pundits. They drive a narrative but will not accept factual rebuttals. Her ranting and constant interruptions to interject another distraction to his response is why we have a cult on the right. 

They spout talking points that are fed from the Trump ideals but don't want his name tied to his actual rhetoric. 

She's a cult follower.",2,0
672,loo3el5,,453,,,She needs to shut up and let him speak,2,0
1254,lopo5tt,,972,,,I could have burned her on 4 points she said. And she just couldn't shut up,0,0
58,losrs01,loqdhw1,50,49.0,"I’m glad I’m not the only one who struggled to watch this. I often feel like I’m not smart enough, eloquent enough, or too hot headed/get angered too easily to fully understand/participate in discussions like this, but maybe I just don’t like obnoxious discussions where one person just talks about the other angrily lol",I watched the entire hour + video. It was something else.,0,0
134,loqu0da,lomnr3b,117,28.0,She spoke way too much and didn’t say a damn thing.,They all do…if they’re concerned about killing children do something to stop killing school kids with gun violence.,0,0
934,loo11f6,,679,,,"Are any if these folk over 30? Not to be ageist but if your not even old enough to have seen more than one or two presidential elections, your likelihood of being brain-wormed by social media talking points is really high. She spouted off talking points younger than the grey hair on my butt",0,0
1382,loqnzy8,,1081,,,Did she just say that only republicans serve in the military in her opening ramble?,0,0
824,loppk4r,,579,,,Corporate Erin has spoken😂,0,0
505,loo12nw,lomr57c,340,325.0,He could have went a better way with the patriotic question in that Democrats have supported veterans unlike the Republicans.,"It doesn't matter with people this obstinate. You could show them absolutely any concrete evidence in the world and they'll go ""that's not true!"" and double down on spouting off what they *want* to believe like it's an actual fact.",2,0
1564,lomxfcs,lomr4h8,1215,47.0,I just don’t see the value of these at all.,Political bots nothin more,0,0
348,lon9em1,lon4ngw,257,258.0,"> all black women need to be pigeonholed to your beliefs

Notice the fact that in no part of their comment did they say anything of the sort.

Fuckin throwaway accounts man. I swear y'all used to at least *try* 🥱",Sorry to break the hive mind hun.,0,1
387,lop2tpy,lonhqsz,274,270.0,"Topic: Democrats are MORE patriotic than Republicans 

Her: *5 mins of nonsense* tell me policies that make Democrats more patriotic 

Him: You mentioned freedom of religion and Trump banned an entire religion from-

Her: WeRe 👏 NoT 👏 tALkInG 👏 aBoUt 👏 ThAT

It’s difficult to have a debate about freedom and patriotism with someone that has yet to master the 2nd grade concept of “more” and “less”","""Is Trump a Republican?"" Should have been his calm measured response.",0,1
1025,loohwsp,,760,,,![gif](giphy|OEh6NI9j38mdAaQHfg),0,0
895,lorbd13,lonpatc,644,643.0,"Where can I find the full videos?

Edit - i scrolled down and found the video posted by someone here. Thanks.","Jubilee middle ground,",0,0
829,lopt2le,,584,,,Idk man seems strange to want to back a man so so undemocratic and patriotic. He would fist lady liberty in front of Putin if it benefits him,0,0
1542,loptvdw,lopsnum,975,1209.0,He’s arguing with a black woman. Wouldn’t that make him racist?,"Oh you’re being sarcastic (I think). I didn’t pick that up. 

Carrying on.",0,0
476,lomw60z,lomr57c,154,325.0,He could have went a better way with the patriotic question in that Democrats have supported veterans unlike the Republicans.,"Maybe if he was actually allowed to complete a sentence, he might have.",0,0
1139,loozb4j,,862,,,Didn't know Tom Holland was in the debate team in high school!! Good for him!,1,0
653,lonize3,,435,,,"Ohhhhh she got fucking cooked there lmao.

Also I find it funny that she is trying to look fair while debating but completely interrupting him every step of the way. I can understand why it happens because from what I can tell she doesn't do this much.

But she is asking 7 questions at once. And barely lets him answer one. And constantly asks why have you not answered yet. It's very funny if you ask me.",0,0
173,lonoidw,lomq43g,141,123.0,Shes brutal to listen to,All of them were.,0,0
39,lopg5uf,lonp7al,33,30.0,"Exactly.

""I made more claims, therefore I'm right""",She didn’t even let this man speak 😂 and there are plenty of liberal service members. They fought for people to be able to express their opinions.,1,0
714,lopb17o,,481,,,Hardly her most embarrassing part of the video but I cannot stand how she keeps saying “Democratics” and not democrats.,0,0
91,loo9beu,lomnr3b,78,28.0,She spoke way too much and didn’t say a damn thing.,I understood more speaking to my manic psychotic schizophrenic patients than what she attempted.,0,0
1580,loqzm2y,loqbdq6,998,1216.0,"lol
Read up on winnowing and tell me how many of those steps Kamala met. The most unpopular candidate. Those votes were not Biden’s to give out, another vote should have been had but they delayed it in spite of bidens cognitive decline so it didn’t happen.","Harris is the most popular politician of anyone running. More popular than Biden, Trump, Vance or Walz. We voted for Biden/Harris in 2020 and in 2024 in the primary. To claim it’s undemocratic for someone to step down is hilarious, but even more hilarious to claim that’s worse than an insurrection lol",0,0
876,lot526b,,628,,,"That lady is out to lunch.

Only there to hear herself talk.",0,0
1126,looy2xm,,157,,,"This is a school exercise, and a very good one. 

But I would answer claims of patriotism differently by first defining what patriotism is and if it's really purposeful.",0,0
1526,loo6baz,loo53d4,1203,119.0,"Can you not see how much she talks and interrupts?  

No one can discuss anything like that",Oh yeah I totally agree on that. That behaviour is awful and ignorant,0,0
1597,loo4x40,lonldgj,119,1219.0,Democrats have been constantly saying how much they hate America for the last few years what is that guy talking about?,Where are they saying that?,0,0
500,loolyht,lonxm9i,337,336.0,She seems to think only conservatives serve in the military? How ridiculous.,She’s clearly disturbed.,0,0
339,loo9ln3,lomrhzv,251,235.0,"Typical right wing trigger word phrases. No substance, just bullshit",Like a pizza cutter. All edge and no point.,0,0
29,loorzkq,loorfjv,24,2.0,I'm glad he didn't. It's an invasive question and none of his business which is his point on women's right to healthcare/privacy. Would just make it a personal attack which is not good debate strategy,“Not a good debate strategy “ - exactly why he didn’t go there,0,0
1080,looo23j,,811,,,"From the moment you see her body language, you know there’s no space for adult dialogue",2,0
1485,louyjzx,,1173,,,How many dumb bitches did this kid have to talk to?,0,0
946,loo4p1c,,689,,,The ones enabling a genocide,2,0
170,lorfkrx,loomv4a,138,139.0,Candace Owens? Really? Oh my.,We can both disagree with what she says and still appreciate the level of intellectual dishonesty that she’s able to serve up. She’s know exactly what she’s doing and she is paid handsomely for doing literally nothing… that’s smarter than the average bear in my book,0,0
913,lonn796,,415,,,She seems more concerned with getting as many gotchas as she can than actually having a fruitful dialogue. Most of this entire video in general was pretty insufferable to listen to. Only like three people in that whole panel were respectful and actually let him get a word in edgewise.,2,0
492,looqtyc,loo02t0,215,4.0,"That's the whole thing that he pissed me off. He interrupted her for two seconds for clarification, apologized for interrupting, then waited patiently for her filibuster to finish, several times, and he could barely get a word in edgewood. Stfu and let him answer your damn question!","She had like 17 questions and wouldn’t let him answer any of them, just keep interrupting to move things further away from the original point",0,0
954,loo6lo1,loo61w6,452,358.0,"These pro lifers when a school kid needs free lunches.

“No.”","And then also calling resources given to poor communities, that she has had to rely on 100% at some point with her father being 30 years in the military, socialistic or socialism.",0,0
1033,looia03,,767,,,Never have I wanted to ball up a dirty sock and stick in someone’s mouth more than this chic.,2,0
588,lon1eib,,381,,,Is she okay?,0,0
751,lonygsn,,514,,,"Watched that - it popped up on my fyp - that was too much, she tried too hard and made no points…..",0,0
658,lonnr15,,440,,,"“I thought this was a dialogue”

Yeah, do you typically talk over and interrupt everyone you have conversations with? Pretty sure thats considered rude in any context",0,0
235,lonsv7k,lomwis6,181,154.0,"Is it stolen valor if you claim your living father ""laid down his life for this country"" because he had a 30 year career in the military?  ",Doesn’t laying down your life entail dying? Lmao,1,0
733,loo1n96,,497,,,"How the hell did she grow up so damn wrong.

Brainwashed into thinking she’ll be accepted",0,0
1197,lop8icg,,916,,,From a woman.  Some people are just brainwashed.,2,0
1617,loqvmm6,,1228,,,Democrats are the first to ban freedom of speech right behind the liberals,2,0
935,loo2icw,,680,,,Bro looks like Tom Holland,0,0
1066,loolnfv,,466,,,"I love my country. I am a Democrat. I didn't support a person who wants to betray our allies in NATO. I don't want to support dictators like Putin and Kim. I don't put a person's AI picture on the flag. I do think our PoWs are heroes, and that our dear servicemen and women aren't ""suckers and losers.""

I don't think that people with a different opinion ""hate our nation and want to destroy it."" I don't support a president calling his opponents childish nicknames.",0,0
109,lop1gi1,lomnr3b,95,28.0,She spoke way too much and didn’t say a damn thing.,Candace Owens disciple/wannabe,0,0
1263,lopry9t,,981,,,I love her smug face when she got him to clarify that it was abortion he was talking about; it was as if she was trying to get him to say the N word in front of an audience.,0,0
569,lops2e8,lon78ja,209,368.0,lmfao roasted,That’s how the dick is gonna come out of that minge,0,0
891,loobmb8,lonf31a,432,88.0,On behalf of all women please give this woman some penis,"She doesn’t deserve it, but I guess it’s a good way to test her IUD. Lol",2,0
948,loo53ck,,691,,,Did these poor morons realize they would be so famously wrong forever? I feel like I’m going to be laughing at this video in twenty years.,1,0
1049,loojx37,,783,,,I feel dumber after listening to her speak,2,0
1362,loqgchh,,1063,,,"What a condescending witch. She didn't come into that conversation with an open mind, just her own agenda and then when confronted by her hypocrisy she caves like a wet paper bag.",2,0
885,loorcdd,,636,,,It's wild to see BIPOC hate themselves so much they have to align with the ones that hate them the most.,0,0
1392,loqs5qz,,1091,,,"Black republicans are a mystery to me, but Latin American republicans and queer republican are in the same boat as them, the moment they're not needed they'll get their face eaten",0,0
851,loqvvaw,,604,,,"Conservatives are very concerned about the unborn but when it comes to the needs of the born, like paying for baby food, healthcare, pre-K support, education, etc., conservatives are no where to be found. 

As George Carlin said: “Pre-born you are fine. Pre-school you are fucked.”",0,0
735,lon6nu9,,499,,,"If you can’t blind them with brilliance, baffle them with bullshit",0,0
718,lopjbfa,,485,,,"""tHiS iSnT aBoUt TrUmP""

The fuck it's not. The reason we're having these volitile discussions is because that scumbag represents and plans to implement all these policies if he gets elected.
So yeah it's Democrat VS republican values, but don't think that the leader of each party isn't at the forefront of it all.",0,0
