id,comment_id,parent_comment_id,user_id,parent_user_id,parent_content,content,support,parody
464,los9we2,lon2gm7,320,313.0,"Notice how in all the clips from this video, the republicans can’t make a single solid point so they resort to constantly interrupting him and focusing on the tiny details of the much larger picture he’s trying to convey. It’s so frustrating and I can see how infuriating it is for him. He’s doing an incredible job not flipping out.",It’s not just the clips it’s the whole video.,0,0
1350,loqf6li,,1055,,,"She wouldn’t let the man talk , it’s so annoying to see with debates. Interrupting people doesn’t usually mix well with staying on point.",2,0
187,lonepl7,lomq43g,153,123.0,Shes brutal to listen to,So screechy,0,0
1148,lop15ey,,871,,,Is this kid going to just keep owning little girls? Someone send him Matt Walsh.,0,0
1225,lopej6d,,943,,,that tom holland?,0,0
609,lonvr5t,,396,,,"She’s just parroting the propaganda that is being fed to her without any substance, you can’t claim that you care about life when you turn a blind eye to children being slaughtered in schools. It’s probably because protecting the unborn doesn’t cost you anything.",2,0
144,looia20,lomnr3b,121,28.0,She spoke way too much and didn’t say a damn thing.,"She said a lot more than the media narrative of “overthrowing gov” which is absolute nonsense manufactured by the LIBERAL MEDIA. She cooked him considering all he does, and every point he makes is repeating brainwashing from the fucking liberal media",2,0
752,lonyivy,,515,,,"Ignoring that the US politics is distant from socialism anyway, how does she reconcile the fact that Democrats are SOCIAList and at the same time INDIVIDUAList/EGOtists in her mind?",0,0
982,looay3y,,720,,,"Republicans think if they talk more then they win the debate, when all they’re saying is nonsense and word vomit",2,0
198,lopmte4,loo0bn1,163,159.0,"My dad was in Vietnam, I’m a patriot. Seriously I’m probably the opposite because of seeing what my father and other vets go through in their daily life’s. If only this dumb chick understood that a lot of conservative policy goes to try to cut funding and programs to help veterans year in and year out.  Yep that’s Patriot.","This can’t be said enough.  Repubs support the active military with funding for more and more equipment (even if not needed,see the attempts to actually decrease the ships and planes we keep up).  However they keep chipping away at funding and resources for those who serve once they get out (like the VA).  

It’s great for them to wave the flag when the planes fly over but help a homeless vet?  They just say GTFO.",2,0
884,looq3kx,,635,,,"He does a good job, but these conservative youth are brainwashed.",2,0
280,loo0iov,lomvoj2,138,212.0,"What is patriotic about *Lists 9 things directly downstream of unchecked capitalism* 


Ma'am, this country was built to do exactly those things by the same class of people that used to and still would own you if they could.",Oh snap!,1,0
294,loqq6bm,lonmdn4,229,221.0,"It’s such a strange argument when anti-abortion advocates come back with “well what if your mother had wanted to abort you when she was pregnant” as if I would hate my own mother enough to want to force her to go through a pregnancy against her will. 

If I were aborted as a foetus, I wouldn’t become an angel sitting on a cloud in heaven complaining about my bitch mother going to hell. I don’t think my existence is more important than my mother being spared from suffering an unwanted pregnancy and birth. 

But typing it out makes it clear that this is where pro-life and pro-choice differ. Those assholes really do think they’d be righteous, scorned angels on a cloud. They really do think their sheer existence is more important than their mother having a choice over her pregnancy and health. It all comes down to selfishness if not straight up narcissism. (And misogyny, of course. Goes without saying.)",">“well what if your mother had wanted to abort you when she was pregnant”

I wish his answer would have been ""Well I'd be happy then, because I wouldn't be having this conversation with you""",0,0
1488,lovg8co,,1176,,,"This is the second video of this kind I’ve watched lately. Besides what people here already mentioned, I can’t help but notice that both conservatives had that terrible condescending smugness about them. Even with no sound, and not reading the subtitles, it’s clear which debater isn’t interested in an actual proper discussion where they let the opponent speak their mind and then reflect on what they said.",2,0
401,loo3zzi,lomytky,281,256.0,She repeated meaningless talking points and then talked over the other kid’s attempt at a cogent response.,"That was everyone in the entire video, it was incredibly infuriating to watch. And they complained he took the whole time when they wouldn't let him speak. He stayed reasonably calm until the very end he cussed and knew immediately that they idioted him to death. 

I'll give credit to one guy he specifically went to the seat with the purpose to let him say his reasons behind his stance so that all the other people coming up couldn't just talk over him. It only happened once though.",0,0
123,lorcdzy,lomnr3b,37,28.0,She spoke way too much and didn’t say a damn thing.,"She's following the Fox News interview gameplan:

1. Ask a question that requires more than a ""yes"" or ""no"" answer,
2. Don't allow the person to say more than 1 word",0,0
1208,lopbs26,,927,,,What a dumpster fire.,2,0
203,loo33pg,lon71zq,164,155.0,Yes. She is claiming to be patriotic because of the actions of others.,There is an easy counterargument there - there are democrats in the military as well.,0,0
836,lopvsyq,,591,,,She’s a fool. Being loud doesn’t make you right,2,0
247,lop8a38,lomwis6,191,154.0,"Is it stolen valor if you claim your living father ""laid down his life for this country"" because he had a 30 year career in the military?  ","It's annoying to hear.
Albeit I only served for 11 years, no one made me do it.
It's a job and I got paid for it, amongst other perks.",2,0
1549,lonkddd,lonau7x,429,1213.0,"Why do they keep posting videos of this little boy who is out of his league debating women, and the posts are acting like he is doing good? He gets smoked every single time.","Talking loud and fast doesn't make you smarter and most of all allows you to ""smoke"" anyone.",0,0
1534,lonoggl,,1206,,,"Why are these children all over Reddit today? They are all a mess. The blond guy slightly less than the others, but he doesn't come off as a rhetoric genius either. Which is fine since they are kids. But why are they everywhere?",2,0
1154,lop1e8f,,874,,,"""The walls in the mall are totally totally tall"" She reminds me of that old looney tunes episode.",0,1
385,lopf1a1,lonhqsz,273,270.0,"Topic: Democrats are MORE patriotic than Republicans 

Her: *5 mins of nonsense* tell me policies that make Democrats more patriotic 

Him: You mentioned freedom of religion and Trump banned an entire religion from-

Her: WeRe 👏 NoT 👏 tALkInG 👏 aBoUt 👏 ThAT

It’s difficult to have a debate about freedom and patriotism with someone that has yet to master the 2nd grade concept of “more” and “less”","I’ve noticed it’s also a super common debate tactic from republicans to come into an argument and say “you’re wrong” and then move the goalposts, then when you try to counter they say “oh but we aren’t talking that, we’re talking about this new thing.” They just hijack the argument, completely ignore your original position, then kept telling you that defending your original position doesn’t count because they’ve changed the topic, so now you need to argue this topic successfully or you lose.",2,0
1613,lomwrog,,1224,,,This thing sounds so scripted,2,0
855,lor1vuu,,608,,,[what is the connection](https://youtu.be/19mnzmf4rMQ),0,0
220,los7yxe,los5s19,157,171.0,"lol, you wouldn’t know pip squeak","If one serves that long one get lifetime health care, a pension, and exemption from property taxes.",0,0
642,lop68fx,lonvgtp,425,424.0,Why do dumb folks talk so much?,They’re not smart enough to know when to shut up,2,0
2,lon8v4q,,2,,,She has an IUD that's why she has no comment on it. Rules for thee but not for me.,0,1
113,lopluhu,lomnr3b,98,28.0,She spoke way too much and didn’t say a damn thing.,I have misophonia. Even if she would (hypothetically) make fair points i wouldn’t be able listen to her. Why the fuck do so many people speak with that cracking voice?,2,0
699,loot0i4,,475,,,"Oh man… another entitled 20 year old who has had all her opinions & talking points spoon-fed to her, by her father her entire life. Oi. Love how she couldn’t wrap her tiny little brain around the IUD question. 😂",1,0
1559,lopkp7e,lopkb6x,1214,1213.0,"The same reason Trump lost to Kamala. He can't respond to her directly. Has to continually change goal posts until he can find an opening for a ""dunk"". It's quite atrocious, actually. He has another one out here that is even worse. It's comical to see that people care more about ""my side vs your side"". Thats why Ben Shapiro and Dave Pakman are incredible debaters where Charlie Kirk and Destiny are not.",">It's comical to see that people care more about ""my side vs your side"". Thats why Ben Shapiro and Dave Pakman are incredible debaters where Charlie Kirk and Destiny are not.

Alright bud, she continually talked over him and got her emotions all involved but if that's your idea of a great debater, then maybe I'm just fucking stupid.",0,0
952,loo5fw3,,695,,,"So she thinks she's the patriotic one but she doesn't want freedom of religion, nor that the pledge becomes optional?",0,0
1432,lorwlse,,1125,,,"Well I mean, Trump has repeatedly called people like her father “idiots”.. so…",0,0
1411,lor60u5,,207,,,We we not a democracy. We are a constitutional republic. Democracy is 2 wolves and a sheep deciding what to eat,0,0
1410,lor60o8,,1107,,,"I’ll never forget that video of the shaman being escorted by police through the entire capitol. They were literally opening doors for him.Yeah, nothing sus about that at all.🙄",0,0
1292,lopybtf,,1004,,,"I watched this whole hour and a half long video and almost none of the trump supporters can bring up valid claims. There were only two people in that entire video that ACTUALLY wanted productive conversation and one of them even ended up stumping this guy. However, it was literally only one person who stumped him and another that actually contributed to meaningful conversation.",0,0
1477,lou1whb,,1165,,,GROSS WOMAN,2,0
442,lopb8mb,lomorx4,310,269.0,Did she say anything?,"She jumped to all these things that conservatives claim. Like caring for veterans, yet it’s often democrats that have to fight tooth and nail for veteran benefits or even first responders if 9/11

But somehow we got all the ay to abortion.

No substance just word salad that activates emotional people with no higher thinking other than fear",0,0
1137,looz4d4,,860,,,"I believe in God, but I prioritize helping a fellow human more than worshipping his/her statue, because god told me to help them - never in my scriptures he told me to worship his statues (I am not talking about a Christian God here).  


This is the same analogy I apply to patriotism. Patriotism to me is to make my country and her citizen better, to defend the democracy that is the foundation of my country. If you think patriotism
 Is worshipping your flag and burning it is anti patriotic, then you are the same “religious” fanatic that I described above and that I don’t aspire to be.",0,0
1257,loppnw5,,975,,,Where can I find this full video?,0,0
1398,loqvzyh,,1096,,,"Sadly, she was one of the more respectful people that debated😬",1,0
664,loo0rm1,,445,,,"It's the black Vivek Ramaswamy, a lot of fast-talking but doesn't have a clue and can't make a point.",2,0
1497,loyo5po,,1183,,,Her stutter at the end😭😭,2,0
1258,lopq5u5,,976,,,She talks a lot with her teeth,2,1
1451,losfqx2,,1140,,,"His point is made even before any debate begins. She tries to say that he has no ground to stand on with his points because he brings in Trump .... I mean, the man said fuck the Constitution and he's the reigning figurehead for the Conservative party. Discussion over. Democrats are more patriotic.

The Don't Tread On Me party sure as shit loves taking rights away. Very patriotic.",0,0
318,loo6p8k,loo1rql,242,241.0,"I’m not sure flipping cars and breaking into shops to steal was done by the police. I wouldn’t try to defend these protestors, they acted like animals and defamed the movement. It was not right no matter what your excuses are.","Sure, and all that could have been prevented if one of the ""good guys"" said ""hey, Derek, back up a couple inches"", so if we're going to cast blame for things, let's get into it.",0,0
649,lon8ggr,,431,,,This truly is tiktok cringe,0,0
1435,los15ke,,1128,,,"As a left leaning center voter, I can’t stand the argument of riots brought on by the Black Lives Matter movement, being democrats burning down cities. It’s a conservative dog whistle, that’s always an immediate turning point that needs explanation when people say that. He too should have argued it, no doubt more sympathizers on the left as opposed to none on the right. But democrats burn down cities and kneel during the anthem, maybe a race of people that are trying to make a change (again) to balance the scales of how they are treated and interact with law enforcement. Surprised as a young black woman she couldn’t make that connection, and the argument her father was in the military, do democrats not serve? You can’t have a political argument and not talk about the choices the voters have right now. She was clearly energized, but her argument was mostly founded in her own religious beliefs, when talking about which side is more in alignment with the fundamentals which this country was founded.",0,0
710,looufrf,,322,,,"Nothing more irritating than a stupid person who thinks they’re smart because they talk a lot, and loudly, over other people.",2,0
1383,loqon6j,,1082,,,Who are these two??,0,0
1283,lopxhte,,998,,,Forcing women to bleed out in a hospital parking lot is pretty unpatriotic to me,2,0
973,loo9j5i,,713,,,"Her bases for reality is already wrong. She doesn’t understand what abortion is and the privilege she has experienced being a protected woman this point in her life. I have had an abortion to prevent me and the baby from being forced to stay in an abusive relationship. Then we have to switch the perspective of women being responsible for getting pregnant and not putting any of the responsibility on the men. Men see sex as sex. Women see sex as affection. Women need affection,love, and protection and receive it from
Men. Men can go without but need sex as much as women need affection. Yes women get horney   like men and want sex but even our orgasms
Are created different. Women orgasms and fall in love and that’s why predators force orgasms on women and men orgasms for sexual release.
The whole premise is wrong and the men who make up these stories about women having abortions are coming from a perspective that women think and respond-like men. I am a women sex is different for us and having sex doesn’t mean the same thing as it does for a man. We don’t get pregnant because we want to have sexual gratification from different men.
That’s a man’s perspective. The man also makes the  choice to ejaculate which again women don’t have control over. 
Men are living in a different reality",2,0
628,lopdl1q,lon8y7c,413,412.0,"She got demolished. She's feeding off the energy given off by her peers cheerleading with all of the little laughs and stuff, especially the one woman the camera kept cutting to, who I think gets laid out in an argument with him in another clip. Makes her feel really comfortable, but not because her arguments are better, but because it's naturally really difficult to actually lose an argument against 1 person when you're a group. 

The debaters would probably choke a lot harder if they were truly 1v1 against him. A lot of them actually do even in this current setting. You can always speak louder and bolster each other up by laughing together when you're a group. It's a huge confidence boost. You've seen it in person throughout your life and even in gaming. You VERY rarely ever see someone feel ""defeated"" in an argument when they're a part of a group against one person, even if their arguments are truly worse. It's just how we are as humans.

When she brings up abortion, she feels supported by the other airhead tag-teaming in the audience. She wouldn't feel so confident if nobody else was around.

I'd probably have the other 20 or whatever ""debaters"" queuing up in another room.","This post sort of auto loaded onto my feed but I totally agree with you. I'm not actually sure what the point is to this video, given that every person he 'debates' in the longer video just screams at him. 

He does a good job of being calm and collected but they all get to walk away thinking they just manhandled this kid in a debate. She's not saying anything, she's not letting him say anything, and any right winger who sees this will laugh and think 'man, they fuckin' housed this kid' simply because they were a group.",2,0
633,lonqcp4,,417,,,"""this is a dialogue"" proceeds to talk over every sentence",0,0
1307,loq0yyc,,1018,,,She can't shut up,0,0
1401,loqz40s,,1099,,,They get worse by the video . This one is full of bluster and nonsense far more than the first debater .,2,0
1409,lor42r6,,1106,,,"I love watching conservatives make each other rock hard.
The key is asking a question and then not letting the person answer.",0,0
1249,lopm8en,,967,,,As soon as she opened her mouth it reminded me of this. https://youtu.be/WDfJn1kcQuU,2,0
1593,loq8oam,loq4fj2,1216,1217.0,"He said ""republicans"" as a group, and judged them as a group, which means ""trump supporters"" since republican party elected and support trump as their nominee.

When doing these discussions about broad groups, you have to first lay out their beliefs. Sure you dont have to support trump to be a republican, but republicans as a group support trump, therefore republicans as a group are less patriotic than democrats",I agree with the point but I don’t agree though that dems are acting democratic as the only goal right now is to stop trump from office so everyone looks the other way to accomplish that goal and objectivity gets cast aside.,0,0
1255,lopodz0,,973,,,kneeling for the flag is patriotic in my opinion.  That shows you care enough about this country to point out its flaws and work towards a better USA.,1,1
1372,loqrqkd,loqjlq8,1072,1072.0,"Where can I see more of this? Because like. This is so entertaining. And respect to the dude, he handled it well. I don’t know wtf she was doing/saying","Might have been obvious, but it’s from Jubilee on YouTube :)",0,0
1355,lor370k,loqfz85,1058,1059.0,Trumps a terrible businessman though.,"That’s debatable since he’s profitable,  business ventures go either up or down, either way he due to his business acumen, he has managed to stay relevant and profitable.",0,0
1569,loq3mci,lopxwnq,1216,998.0,Trumps running for president and he’s pointing to Trumps policies. Supporting a traitor and that traitors policies is pretty unpatriotic,"Trump should be in prison. Fuck him. 
But if you are talking about defending democracy dems have a candidate no one elected, that doesn’t bother you ? That’s more undemocratic than what happened on Jan 6th( a protest gone wrong).",2,0
1508,loqtd4c,,1194,,,She somehow said a lot and said nothing at all,0,0
796,lop9jqs,,553,,,"She was insufferable from the jump. IDK it was a room full of right wingers until the guy suggested it but it makes the chick so much more insufferable.  

Fox News gen z edition",2,1
646,lon4fgt,,428,,,Who is this young man?,0,0
1013,looghqc,,749,,,This girl loves the sound of her own voice.. and clearly thinks she's the smartest in the room,0,0
557,loqrpft,lopozn1,360,227.0,Except more often than not what ended up happening is they would raise 10 flags if anyone let the liberal guy explain his side too much. They just didn't want him to talk.,"Honestly, agreed. I hadn’t watched the actual video yet when I made my above comment, just a couple minutes in to get the rules and made an assumption.(my b 😅)  I’ve since watched the video (most of it at least: I had it playing in the background so def missed some of the fact checks that came up on screen) and it really felt like actual valid back and forth debate was flagged but the most brain dead arguments were allowed to stand as long as they just kept the liberal guy from speaking. And the people at the table *definitely* picked up on that right away",0,0
682,loodcqf,,461,,,He’s basically saying in consideration of what was done by democrats it doesn’t reach the level of unpatriotic behavior that Trump reached by doing his January 6th BS. I think that is a solid argument.,2,0
578,lonhutl,,374,,,She def has an IUD,0,0
1110,loovbzo,,836,,,It’s the smugness for me.,1,0
1267,lopu2qg,,584,,,So…. Could she make a point of is she on coke?,2,0
1184,lop5g7g,,903,,,Her father served 30 years and she never noticed how many republicans want to strip his entitlements?,0,0
525,lonfa8j,lonbcq5,354,353.0,"I’m assuming you didn’t listen to girl yelling at Charlie Kirk saying “She hopes his daughter gets away from him”. If you actually watch both episodes it’s very clear which group has more respect for other people and which group is more ready to run each other over to scream nonsense into a mic.

Edit: All of you downvoting my comment I dare you to watch both episodes on mute, just watch the actions of the people, how they interacted amongst themselves, then come back and tell me I’m wrong 😏","This isn’t even a negative or insulting or threatening thing. Charlie Kirk has some pretty openly anti-women views. What if his daughter is queer? That would add another layer of discomfort living with someone like Charlie Kirk. To me, that woman is yelling “I hope your kid gets safe.”",2,0
1060,lookjr9,,793,,,"First she had him on the ropes with keeping the subject away from relating to Donald and Harris but he came with the comeback with asking her if IUDs make a woman a murderer for having them, nice debate",0,0
541,loni8el,lon2blq,355,352.0,why are conservatives always so insufferable,"If you think this is bad, it's nothing compared to the other lady he was talking to in the video.   
I had to stop watching. This guy is much stronger and way more patient than I am when it comes to getting cut off and not being able to speak for more than 5 seconds.",0,0
1195,lop88hv,,914,,,Brave man! Good for you keep hope alive.,1,0
749,lonx0me,,512,,,Calm collected Vs loud obnoxious,2,0
1511,loslurp,,32,,,The constant patience needed to deal with individuals like these is draining,2,0
1431,lorvgwe,,1124,,,It is absolutely normal to be turned off by conservatives. It is an ugly way think through life and a red flag if ever trying to tie any aspect of your life to anyone else.,0,0
485,lonua6q,lonqa1p,328,327.0,"I was thinking the same thing, I could never keep my cool the way he did. Bravo!",Composure and polite. He let her speak even when she wasn’t making any sense. Meanwhile she cut him off every time he opened his mouth.,0,0
96,lopgpzg,lomnr3b,83,28.0,She spoke way too much and didn’t say a damn thing.,She reminds me of Cecily Strong’s “woman who you wish you hadn’t talked to at a party”,0,0
1021,loohjmt,,756,,,"She is soooo loud for saying soooo little… is amazing how angry she is at lies, not a single thing she said is real",2,0
564,lonea9w,,365,,,"Did her dad die? Serving in the military and *not dying* is not ""laying down your life""; it's a chosen career. Lots of jobs have a risk of physical harm. Someone can die attempting to deliver a pizza to you but if they don't, you wouldn't say they laid down their life for your pizza. ",0,0
1265,lopt2o3,,982,,,"Try not to look stupid hard mode. Jeez, the number of times she spoke through him and just Gish Galloped onto the highway of stupidity",0,0
743,lonni2z,,506,,,Listening to her was more exhausting than a 5km run,0,0
864,lorcacs,,617,,,My dad was in the military too.  So we are evenly patriotic in her eyes.,0,0
892,lonhh3z,,641,,,"People that act with their face are weird, it’s so unnerving, their main character syndrome is too damn high!",0,0
1039,looiwre,,773,,,"Ma'am..what you’ve just said is one of the most insanely idiotic things I have ever heard. At no point in your rambling, incoherent response were you even close to anything that could be considered a rational thought. Everyone in this room is now dumber for having listened to it. I award you no points, and may God have mercy on your soul.",2,1
207,lootxxu,lon71zq,166,155.0,Yes. She is claiming to be patriotic because of the actions of others.,"Not to mention: not all service people are Republicans, not even close.",0,0
393,loqve7l,loquvfl,217,275.0,"Ok cool and that's all laid out in this clip?

Come into this video with no idea of the premise of what they're doing and tell me that you can instantly know what it's all about.

You can't, it's an excerpt.","Yes, all I've seen of this is this one clip. He starts by saying that Democrats are more patriotic than Republicans. She then wants him to defend that and goes on a huge rant that was a waste of breath. He then gets to explain and brings up Trump and how people still support him despite J6 and she cuts him off to rant again.

It's all in the 5+ minute clip.",0,0
