id,comment_id,parent_comment_id,user_id,parent_user_id,parent_content,content,support,parody
302,lot7fxb,lopx36x,220,231.0,"Man if you think she’s bad, you should watch Parker try to debate Charlie Kirk. He makes this chick look smart and soft spoken","Charlie Kirk cant debate, he likes to argue. His opponent will give him speaking time, just to turn around and interrupt them when its their turn to talk. Hes a well-spoken fool who pulls the same tactics that Steven ""wife abuser"" Crowder used at college campuses.",0,0
497,lon7ont,lomr57c,335,325.0,He could have went a better way with the patriotic question in that Democrats have supported veterans unlike the Republicans.,He could have brought up what the Republicans did with the burn pit bill.,0,0
1404,lor1xlf,,1102,,,I really dislike it when people say they want a “dialogue” when really they just want to yell at the other person.,2,0
1363,loqgoi9,,1064,,,I tried to watch this but I can’t take this kid sputtering why she just says blah blah blah over and over again,0,0
1343,loqbsx6,,1049,,,She likes the sounds of her voice way too much for what is happening here.,0,0
518,lon7pwu,lon4t7d,212,349.0,"Yes, in her simple mind, because her father is in the military and a conservative, all service members must be conservatives fighting for the country. I wonder how she feels about the Army veteran that told Colin Kaepernick to kneel for the pledge? She's just young, impressionable, and really fucking stupid.",John Kerry even ...,0,0
1070,loomak4,,801,,,Like playing chess with a pigeon,0,0
477,lonij9m,lomw60z,296,154.0,"Maybe if he was actually allowed to complete a sentence, he might have.",I gotta hand it to this kid. He kept his composure.. I would have blown up in rage with how stupid they all were. Just oblivious to all reason...,2,0
158,lonka5j,lon5o47,129,125.0,I'm really grateful for the subtitles.,I don't speed read so that would be useless. Probably seizure inducing to try to keep up,0,1
1244,lopjj9h,,962,,,Tom Holland?!,0,0
1196,lop8eiz,,915,,,That girls mouth is really fking annoying and the sound coming out of it even more so,2,0
17,loqi6dy,lopmsk0,16,2.0,"Very true. My brother is a trump supporter and his main reason is because of immigration. he thinks they are coming into our country with the purpose of wreaking havoc. I'm here like, both our parents are immigrants. We are first generation americans. You're here wreaking havoc with your opinions on others....his response. ""it's different""","""The only moral abortion is my abortion.""",0,1
1073,loomxgc,,804,,,She just talks too much. My condolences to anyone who will marry her some day.,2,0
1610,lp6iclo,loq4cgg,1222,1216.0,"That’s not how it works. It creates a barrier and inflammation to prevent implantation of the fertilized egg, but it’s no an abortion because implantation into
Uterus has not occurred. 

He tried to sound smart counting on people not knowing and not bothering to investigate.","Life starts at conception for a lot of pro lifers. So it is technically an  ""abortion"" in that case",0,0
547,loo6y3t,lon2blq,358,352.0,why are conservatives always so insufferable,"They believe sky father made us to rule earth and do anything we want….

Not a lot of logic in that party.",0,0
659,lonpqts,,441,,,"It seems that they think that by continously speaking and interrupting, they win an argument. Really aggressive debate form but at least they are speaking to each other I guess, though barely.",0,0
1331,loq7a6b,,1040,,,This bores me,0,0
1020,loohbse,,755,,,Diarrhea of the mouth.,2,0
1456,losmmdm,,1145,,,I've seen a bunch lately. What is this?,0,0
960,loo6jdc,,90,,,"These right-wingers spew a ton of straw man arguments and ad hominen attacks, and constantly interrupt without listening.  They also use circular logic and refuse to at least acknowledge any valid points presented.  They NEVER debate in good faith and always come across hostile.  She as well as the other girl that debated (if you can call it that) this guy just vomit words, right-wing talking points, and it is so frustrating to watch them in settings like this.",2,0
1535,lonorjy,lonoggl,1207,1206.0,"Why are these children all over Reddit today? They are all a mess. The blond guy slightly less than the others, but he doesn't come off as a rhetoric genius either. Which is fine since they are kids. But why are they everywhere?",Because they are voters. Because they will be the next generation that steers the direction of this country?,0,0
284,lonmdn4,lon8xq7,221,220.0,"Classic shitty debate tactic. Talk louder than your opponent and get emotional. Shit, throw his mother in there, too. Lol why not? She was just insufferable. Also, you know those conservative men would have different opinions of her if she wasnt on their side.","It’s such a strange argument when anti-abortion advocates come back with “well what if your mother had wanted to abort you when she was pregnant” as if I would hate my own mother enough to want to force her to go through a pregnancy against her will. 

If I were aborted as a foetus, I wouldn’t become an angel sitting on a cloud in heaven complaining about my bitch mother going to hell. I don’t think my existence is more important than my mother being spared from suffering an unwanted pregnancy and birth. 

But typing it out makes it clear that this is where pro-life and pro-choice differ. Those assholes really do think they’d be righteous, scorned angels on a cloud. They really do think their sheer existence is more important than their mother having a choice over her pregnancy and health. It all comes down to selfishness if not straight up narcissism. (And misogyny, of course. Goes without saying.)",0,0
798,lopa64e,,554,,,"I just love how the Republican idea of ""freedom"" is really just ""freedom to do what we agree with"", which is not freedom at all. It's the exact kind of oppression the colonists came to America to escape from in the first place.

They want freedom to impose their views and beliefs on others, but if I want the freedom to decide what happens with my own body, the freedom to love who I want, the freedom to worship the God I want, etc. suddenly freedom isn't such a great concept anymore.",0,0
1332,loq8fn5,,1041,,,What context are the videos being created?  Is it some forensics competition?,0,0
226,loog737,lonuz7v,165,168.0,"""He doesn't get those years of his life back.""  Does he want them back?  I thought he was proud of his service.",10 bucks says he was chairforce. Don’t come for me Air Force I say this as the daughter of an Air Force veteran who never saw combat lol.,0,0
27,looq9tj,lon8v4q,23,2.0,She has an IUD that's why she has no comment on it. Rules for thee but not for me.,He should have asked her if she had one in,0,0
1448,losbuaf,,266,,,lmao so basically this chick has an IUD.,0,0
438,looav24,lomorx4,308,269.0,Did she say anything?,"She said a lot with her smug attitude, not so much with the sounds falling out of her face though",0,0
1589,lougbm6,loug18v,998,1216.0,"That’s not really saying anything. 
The presidential pen is more popular than trump 🤣",The presidential pen and desk are both incredibly popular… 🤦‍♂️,0,1
230,lonupx0,lomwis6,177,154.0,"Is it stolen valor if you claim your living father ""laid down his life for this country"" because he had a 30 year career in the military?  ","This exaggeration sounds completely stupid und hollow. Let’s say he worked in the service. Doing what? She makes it sound as if he were winning the Iraq campaign on his own losing two limbs and maybe his eyesight. If it was so, he even died mb she would’ve said so. 

Or maybe he’s just having a nice desk job, worked as  a janitor, driver or was in the National guard and never experienced combat. 
He laid down his life? C’mon. He earned his living doing a job no one forced him to pick. Or just sounds dumb and pathetic coming from her mouth.",2,0
38,loslfwo,look7tz,32,31.0,Education sponsored by Fox news,"Freedom of religion if it’s the one I believe in .Im sure if other religions funded politics,it wouldn’t be supported",0,1
750,lonx7jo,,513,,,I lost multiple braincells listening to her.,2,0
1046,loojqww,,780,,,Ego is real in this one,0,0
470,lop21tm,loot8dv,230,322.0,"I know exactly who you’re talking about. That rage-bait piece of shit blonde woman who kept bombarding him with questions and not letting him respond, then she started demanding an answer from him while clapping her hands 👏👏👏 in that extremely condescending way like he’s wasting her time, then as soon as he starts talking she starts firing off more questions and interrupting him. That dude has the patience of a saint, that’s the kind of person where you know they have no interest whatsoever in having a dialogue, they’re just trying to piss you off and I would’ve taken the bait and smacked the shit out of her lol, she was really really really getting under my skin",Right! I was ready to slap her through my screen too 💀,2,0
1389,loqr48i,,1088,,,1 Democrat = 20 MAGA,2,0
1606,loofp0e,looentw,728,1221.0,"So, she pointed out actual flaws or causes for concern towards the left party. She mentioned, burning the flag, destroying buildings, trying to remove “in God we trust” from our currency, paying respect to our country by putting your hand over your heart, NOT KNEELING, and our amendments. The very first thing that comes out of this bonehead’s mouth is trashing Trump, when he was nothing to do with the question. And if u so badly want to include him, go pull up the famous picture of him raising his fist with a bloody ear after the shooting. That’s as American as it’s gets. Democrats have completely destroyed the fundamental aspects of what made America so great. And then they go ahead and claim they are for democracy.","Imagine completely missing the point that your party is unpatriotic because it's leader attempted a coup because you think that mentioning their name along with some facts is ""trashing"" them.",0,0
688,loolxoi,,466,,,She doesn't let him talk. Not a good look,2,0
1503,loos5yg,,1189,,,"Haha ofc she got IUD, that would just be chef kiss*",0,0
640,loptcbm,,423,,,Love how she thinks she did something. lol,1,1
1407,lor2e5p,,573,,,Anyone know where I can watch the whole debate?,0,0
1219,lopdv5q,,262,,,"Not to mention, “laid down his life”, means he died. Sounds like he had a 30 year career and didn’t do that.",0,0
1159,lop25jh,,879,,,The girl seems arrogant.,2,0
1357,lor3z8n,loql5pr,1058,1060.0,He is not even a good businessman. That’s a facade he worked to keep up. Five bankruptcies and not paying workers and contractors does not make someone good at business.,"Sorry, but bankruptcies and not paying contractors and workers doesn’t mean he’s a bad businessman, unethical yes, but bad, no. Business is all about the bottom line and the ability to stay relevant. Yes, he’s had failed businesses but he also has generational assets and business ventures that have continued to grow. Don’t underestimate someone by looking at just the surface, he has depth of knowledge and experience running businesses.",0,0
1301,lopzvpo,,1012,,,Why is she talking like that?,0,0
1487,lov0ru8,,1175,,,Damn this kid has killed more women in this debate than the repeal of Roe did,2,1
801,lopemxb,,557,,,"Patriotism isn’t about a stupid flag or kneeling. It’s about our individual freedom of choice. If she wants to kneel to a flag and have a man’s 10 babies good for her, but it’s my American right NOT to do that. It’s my patriotic choice not to do that and Republic conservatives like her are trying desperately to take that away. That doesn’t sound very patriotic.",0,0
161,lonphoy,lon15ht,131,124.0,I watch these videos on mute.,A gentleman and a scholar.,0,0
957,loo69lk,,698,,,The way she talks is just obnoxious and she doesn’t know jack shit,2,0
1187,lop6euu,,906,,,She's more patronizing than patriotic,2,0
822,lopomcp,,577,,,Her argument that they shouldn't be talking about Trump is hilarious. He's literally been the leader of the Republican party for nearly a decade.,0,0
1380,loqnlwu,,1079,,,"I don't really agree that this is the way to show that democrats are patriotic. My points would be things like:

Not betraying our allies in crisis

Treating the institutions of the US with respect

Increasing the franchise

Prioritizing justice over toughness in criminal justice

Accommodating and supporting all American citizens regardless of race, place of origin, ethnicity, sex, gender, sexuality, or political affiliation.

Taking a hard stance against the clearest enemies of the US and her principles(confederate sympathizers, Nazis, Fascists, authoritarians, theocrats)

Accepting civic responsibilities such as paying taxes

Democrats aren't perfect, but at the very least they have stronger faith in the ideals of America. Republicans focus on the aesthetics of America and trample on the ideals.",0,0
878,lon4pyb,,630,,,Wait this guy is 1v20 in this shit?,0,0
914,lonnf0q,,660,,,"Patriotism is the same amount of letters as cuckholdism, and not much different in it application",0,0
153,lon15ht,lomq43g,124,123.0,Shes brutal to listen to,I watch these videos on mute.,0,0
1498,loze1rg,,1184,,,I feel like he could have also addressed the fact that republicans have negatively impacted the healthcare outcomes of vets as well as not helping them afford and or attain housing.,0,0
510,londwkm,londpm5,345,344.0,"I couldn't finish this.

That bitch needs to close her fucking mouth to allow for debate.

Her just spewing shit out was unbearable.","They were all pretty rowdy. The guy in the last part was DECENT but still a mess. 

the Mexican/Latino (can't remember his background) guy was comedy gold. 🤣🤣",1,0
1136,looz07w,,859,,,"I wish they'd actually make a point and allow him to respond. They just came to hear their parents' talking points come out of their own mouths. Her smug attitude did not allow her to come in good faith for a real discussion, while he is sitting there, listening, and offering sincere rebuttals, questions, and explanations.",2,0
1251,lopnjvw,,969,,,Right... So... What are you saying?,0,0
1365,loqgxa6,,1066,,,Republican minorities are some of the most ignorant and disgusting people in existence,2,0
104,loo6pqy,lomnr3b,90,28.0,She spoke way too much and didn’t say a damn thing.,Exactly!,0,0
587,lona4kv,,380,,,Her misplaced rage made me so uncomfortable that I had stop watching.,1,0
1446,losaai8,,1137,,,I love how she asks a question and then talks for a full minute about the people cable news made up for her to hate.,0,0
1144,loozzmk,,867,,,"Did he get paid to do that?  Lol, hats off to him but I would never do that without a paycheck.",1,0
54,lood6yr,lomnr3b,47,28.0,She spoke way too much and didn’t say a damn thing.,[deleted],0,0
152,lomq43g,,123,,,Shes brutal to listen to,0,0
404,lox817p,lotwt77,282,281.0,"Here you go, https://youtu.be/68aej2qmCtw?si=o38QyugLwAZLOqd2",Thanks,1,0
1600,looinns,looag40,119,1219.0,You deadass? I mean she says it. Burning flags. America is so racist. Etc.  whereas America is arguably the most tolerant melting pot on the planet.,"Oh, she says it

That’s it?

What if I counter with just as valid an argument: they aren’t saying that.

Now what?",0,0
208,lop1q0w,lon71zq,167,155.0,Yes. She is claiming to be patriotic because of the actions of others.,Typical Republican,0,0
1544,lors3n6,lopvupn,1210,1209.0,You got me. lol. I don’t like the male debator. He isn’t using logic to win. He’s using aggression and bully tactics. So I’ll call him out using same tactics he would use,"He’s actually using tons of logic, this video is over an hour long and he is debating against almost everyone around him 1 at a time. He did a great job at it, even though he did get a couple facts wrong it seemed (based on the fact checking). He was one of few people there who truly seemed to have any idea of what they were talking about.

Go watch the whole video and then make your decision, I did 🤷‍♂️",1,0
1123,looxwqo,,848,,,She sounds like she is trying too hard to find a white nationalist boyfriend.,0,0
1433,lorwqsm,,1126,,,Everyone knows dems can’t serve the country /s,0,0
9,loo08vr,lon8v4q,9,2.0,She has an IUD that's why she has no comment on it. Rules for thee but not for me.,She couldn’t stop going on mindlessly without making any valid points but that question stopped her in her tracks! Haha I was like well then!!! Missy is at loss for words here 👀 wonder why,1,0
1015,loogmll,,751,,,So annoying,2,0
1466,lot6dxa,,1155,,,Where do they find these young dumbasses,2,0
1061,lookutk,,794,,,she can’t stfu,2,0
453,lopoday,loo6pj5,227,314.0,"the MOMENT he got to finish a sentence her response is ""no comment""",I bet she has one and that's why.,0,0
254,lopxdck,lomwis6,197,154.0,"Is it stolen valor if you claim your living father ""laid down his life for this country"" because he had a 30 year career in the military?  ",I just tell people I tried to enlist and got rejected because of an injury suffered in a car accident that a drunk redneck caused. Shuts them up real quick.,0,0
1328,loq6bu5,,1037,,,It doesn’t help to give these deranged morons a microphone.,2,0
897,lonces8,,646,,,Spider-Man: We Have Tom Holland and Zendaya at Home,0,0
1421,lormb7e,,1115,,,This kid is very good at a young age. Props to him and I hope he keeps it up 🫡,0,0
881,loond35,long7d3,502,632.0,"This video is still biased towards the right-wingers, they still call the kid woke lmao","They call everything they don't like ""woke"". It doesn't even mean anything anymore.",0,0
1539,lopqalb,loppzf7,1209,975.0,How so?,Oh I thought baseless claims were the game we were playing. That’s certainly the game he’s playing.,0,0
624,lonvyhu,,409,,,"Like all the stuff she just spew in the first seconds is exactly what the Donold is shitting on permanently.

They don’t want a dialogue this is just throwing buzzwords into the face of your opponent and looking for approval from the others around.",0,0
346,lon4ngw,lomze0r,258,257.0,You mean they think differently than you? I'd say it's pretty racist that you believe that all black women need to be pigeonholed to your beliefs. And what you think they should believe. And aren't using the usual democratic rhetoric. They better fall in line huh?,"> all black women need to be pigeonholed to your beliefs

Notice the fact that in no part of their comment did they say anything of the sort.

Fuckin throwaway accounts man. I swear y'all used to at least *try* 🥱",2,0
1399,loqww2f,,1097,,,"He could have said what does she understand by ""others"". We should kneel before the sacrifice of ""others"" fantastic, but who are the others to her. Because promoting the rights of all americans is what democrats try to do. If she has a different concept of others then that is where the difference lies, for the democrats everyone who choses the country is an american, for the republicans idk who is american. Remember US was founded by inmigrants, so there is nothing more american than coming in to build a dream of prosperity.",2,0
263,los5kzb,lomwis6,171,154.0,"Is it stolen valor if you claim your living father ""laid down his life for this country"" because he had a 30 year career in the military?  ",Not stolen valor,0,0
1322,loq4ud1,,1031,,,"Are there no patriotic democtratic soldiers? And if a republican soldier kills a person in combat , is he then still prolife?",0,0
151,looqpgc,looql04,122,28.0,"Cool, thanks for adding nothing to the conversation.",I’ll find the video and send it to ya.,0,0
473,losnit8,lomxpu0,324,256.0,"That girl is the perfect encapsulation of the self-righteousness and narcissism that MAGA people engage in regularly. Repeating a raft of conservative media talking points proves nothing when you’re not interested in anything but trying to ‘own the libz’. The lack of empathy and self-awareness that it takes to ignore the root causes of all of the issues she mentioned shows that it’s not about solving our problems as a nation but being able to use those problems as some sort of ‘gotcha!’ against those she politically disagrees with. She fails to mention that instances of fires being set and police being murdered in 2020 George Floyd unrest were committed by Trump supporters (Minneapolis police station fire, Oakland police murders). She blows off mentions of Trump instigating January 6th & attempts to overthrow the election. She wants to think she’s so patriotic because her father served in the military, but yet many people engaged in the insurrection and trying to overthrow the election also served in the military and consider themselves ‘patriots’. That word has been bastardized by right-wing extremists in the Trump years just like they bastardized ‘freedom’ during the astroturfing of the Tea Party during the Obama years. Those words lose all meaning under those circumstances. She wants to demonize the increasing homeless population as a byproduct of liberal policies but it’s really about the homeless being victims of Capitalism and Republican politicians having zero will to work on a solution for the issue because it might entail increasing taxes on millionaires & billionaires to do so.

This girl in the video did not espouse a single independent thought. She simply regurgitated a bunch of meaningless talking points to form a word salad that makes her feel informed. However, the ideas, anecdotes and accusations are just warmed over tropes that conservatives have used for over a decade to mislead other conservatives like Fox ‘News’ viewers & it looks extremely silly to ACTUAL informed people like the young man she’s yelling at. If he could get a word in, he’d probably tell her as much.","I felt like I was going insane when she listed homelessness as a problem and then said that it was DEMOCRATS who were selfish and self-centered ?? Sorry, you mean to try to argue that the party that actively tries to solve the homelessness problem through housing or other assistance programs, tries to push for healthcare for all, and tries to restrict gun laws for safer schools is....selfish? But the group that refuses to pay taxes because the benefits don't help them specifically, that rallies against suggestions that don't even WANT to take their guns away but rather just have stricter laws to keep children safe, that doesn't give a shit when veterans are on the street or being ignored by shitty VA doctors for whatever reason--they're the righteous self-sacrificing ones. Sure.",2,0
641,lonvgtp,,424,,,Why do dumb folks talk so much?,2,0
1619,lore0zd,,1229,,,"
She did a great job bring up solid points .",2,1
1536,lop6rpm,lonoggl,1208,1206.0,"Why are these children all over Reddit today? They are all a mess. The blond guy slightly less than the others, but he doesn't come off as a rhetoric genius either. Which is fine since they are kids. But why are they everywhere?","Username checks out, the ""ish"" might be unnecessary. They are the leaders of tomorrow, of course it's interesting to understand them ""discuss"" today's main political topics.",0,0
551,lonw8o1,lons0zx,362,361.0,Knowing that context now makes it so much funnier because of how *fast* they wanted this girl out of the seat because they already knew she was going to make a fool of herself. 🤣,They wanted their turn to be the fool.,0,1
929,lonx3pr,,674,,,What is this from? I’ve been seeing a bunch of posts from this one video lately,0,0
489,lonqrpc,lonij9m,290,296.0,I gotta hand it to this kid. He kept his composure.. I would have blown up in rage with how stupid they all were. Just oblivious to all reason...,He’s an adult,0,0
1480,louhjuc,,1168,,,Wow she is cancerous,2,0
1172,lop3ydg,,892,,,"Saw another video of that guy and I applaud him for trying to stand up for his beliefs in a room full of conservatives, but it’s abundantly clear that not a single person there even attempted to listen to him. They just repeated the same disproven conservative talking points over and over again then ignored any arguments he tried to make against them. There’s simple no fixing stupid because some people would rather ignore opposing thoughts instead of form their own opinions",0,0
147,loopv9n,loopp0q,122,28.0,Like when she talks about Hannibal Lecter?,Nah when she answered that couples question on that news channel.,0,0
1572,loq9uo5,loq865d,998,1216.0,"Btw, “insurrection” is a stretch. Bunch of unarmed dumbasses ( like most trumpkins) on a protest that got out of hand, insurrection is treason and punishable by death.",It was an insurrection - the president sent an armed mob to the capital with the goal of overturning the results of a fair and free election. Literally the definition of an insurrection.,2,0
403,lotwt77,loomicg,281,282.0,Do you have a link to the video?,"Here you go, https://youtu.be/68aej2qmCtw?si=o38QyugLwAZLOqd2",0,0
955,loo62rm,,696,,,"you can't debate someone like this, it is literally impossible.  she used every tactic to derail him, from asking multiple open ended questions, interrupting and talking over him while he was answering, and just not wanting to actually hear his answers.  

I commend him for doing this, but it is just a colossal waste of his time and these people will think they came out on top.",2,0
1531,loraxpj,loo0k7f,644,1203.0,"I see no actual dialogue from both sides.
I was waiting for some clever comeback or outsmarting. Both sides have pretty weak arguments.","If she let him talk, or didn't disregard his clever comebacks, his argument would've been stronger.",0,0
660,lonrbhh,,442,,,She’s spent far too much time watching Candace Owen’s even has the same nasally whining voice,0,0
1373,loqk6o7,,1073,,,She’s an idiot.,2,0
