id,comment_id,parent_comment_id,user_id,parent_user_id,parent_content,content,support,parody
488,looflc3,lonij9m,329,296.0,I gotta hand it to this kid. He kept his composure.. I would have blown up in rage with how stupid they all were. Just oblivious to all reason...,"Unfortunatelly, that's how a lot of ""x conservative destroy liberal"" content works. They say outrageous stuff and constantly interrupt you or even try to get personal in order for you to ""blow up"" and then use that as a justification for them winning since you ""got emotional"" and they have the ""facts"". Look at what that women said, she basically repeated the same non point like a dozen times while constantly interrupting him. That's how they ""debate"" now.

I remember the previous video that YT channel posted about the little face conservative man and a clip about a woman blowing up to him about abortion rights. He used that strategy that I just mentioned and, even though that clip was uploaded here as proof of how he lost, in conservative circles it was the opposite since that woman got ""too emotional"" and therefore was apperantly wrong. You could even find comments like that here.

That's how the whole ""facts over feelings"" lie comes from in the first place. Even if you only ""get emotional"" it once in a 50 minute debate, they will crop that clip and constantly use it as proof of them winning. No matter what anyone said in that exchange or before it, you got ""triggered"" therefore you lost.",0,0
560,losvu1y,losv2t2,227,360.0,Yeah she absolutely made my blood boil. The guy got a little flustered but man I don’t think I wouldn’t have handled that half as well. The fact that she was absolutely relishing in the fact that she was just making it impossible for him to speak was ridiculous. And she wasn’t the only one either. It was so annoying that was allowed to go on for as long as it did,"I was exceedingly annoyed that they let that continue for ANY length of time. You know they were relishing in it. If it were me, I would have set both my elbows on the table, set my head in my hands, and then just STARED at her in silence until 10 flags went up. I'm not engaging with that bullshit.",2,0
1142,loozuiy,,865,,,If democrats were really patriots they would ... magically rid the world of all crime and human suffering?,0,0
1120,loox1qw,,638,,,"She took the shapiro approch. Spew a bunch of nonsense not connected to her main premmis while ignoring his arguments against her many premisis. Then when pressed "" no comment"" and just dropped it. She could not handle any push back on her basis of beliefs",2,0
802,lopezdw,,558,,,People that say “no comment” during a debate know that if they comment they’re just going to prove the other person’s point as correct.,0,0
513,lopppqu,londpm5,227,344.0,"I couldn't finish this.

That bitch needs to close her fucking mouth to allow for debate.

Her just spewing shit out was unbearable.",You missed the best part where she refused to answer if an IUD was murder... probably cause she most likely has one.,0,0
634,lon85vj,,418,,,"shes so smug, theres so much talking and no listening.",2,0
1204,lopa5fb,,923,,,2 parties dividing and conquering,0,0
1633,lop118i,lond5d8,316,1235.0,Dems burn flags,"Burning a flag as protest to tyranny is a protected first amendment right.

The GOP shits on veterans, strips rights, tries to destroy the constitution and democracy, and supports a traitor who tried to steal the election.",0,0
1151,lop6eft,lop5w1m,872,871.0,Staged AF,"Sure bud whatever you want to believe, it's still a free country. Watch the whole video and then say that",0,0
791,lop5u47,,548,,,"Credible lawsuits - Trump is accused in sworn court testimony of raping a 13 yr old girl supplied by Jeffery Epstein, according to the victim and a second witness. The girl and her family were threatened / murdered if they didn’t drop her cases 2x. 

Sworn testimony were Trump is reassuring the victim saying “It is very sexy to be raped”

Here are case numbers.
 SDNY 1:16-cv-04642, then SDNY 1:16-cv-07673
Google the cases but be aware they’re a horrible read.",0,0
117,lopqmdo,lomnr3b,102,28.0,She spoke way too much and didn’t say a damn thing.,"Seriously, all she did was complain. She probably thinks she crushed it by cutting him off and ranting. She came there to pick a fight and not to have a debate.",2,0
741,londkmi,,505,,,"It is just a lump of cells, people want to give it more meaning than what a fetus is but just like any other thing we can give meaning to... at the end of the day it's still just a lump of cells.

Ignorant to science, ignorant to the world, and ignorant on how to debate someone with any actual substance beyond but ""MY DADDY"". \*rolls eyes\*",2,1
1082,looopbh,,813,,,Damn she’s fucking annoying,2,0
831,lopt9q0,,586,,,I agree with Peter Parker on this,0,0
120,lopsv8g,lomnr3b,105,28.0,She spoke way too much and didn’t say a damn thing.,"just like Trump. talks way to much, and never makes sense",0,0
657,lonmurc,,439,,,"So she never actually said anything, anyone else catch that? Did the teleprompter break and she repeated the same line over and over?",0,0
1553,losc99x,lorinol,429,1213.0,A threat to whom? Society? The girls?,"To conservativism. To your identity. You are coming off as if he making a good point, you get mad so you ad hominem... you got nothing else.",2,0
636,loo7qpf,lon5jlj,358,419.0,Why is she so dumb,America education. Where we force underage children to make pledge allegiance to the flag 🤡,0,0
370,loo0o1d,lonhbbi,264,257.0,So we're going back to the slavery thing? What straw man is this? What party supported slavery in the civil war again?,">What party supported slavery in the civil war again?

Walk up to any KKK member or person waving the confederate flag and call them a democrat, see what happens.",0,0
269,losmii5,loprko7,210,209.0,"“Bitch, shut up or you gonna get us in trouble”",🤣 this is hilarious this got me,1,0
656,lonmauy,,438,,,"Damn, she couldn't help being such a bunch of cells",0,0
936,loo2olh,,681,,,"GOT YOU, BITCH!!! 

That ending was so satisfying.",1,0
823,lopoy02,,578,,,Democrats destroyed the nuclear family ? Wtf?,2,0
867,lorsrg6,,620,,,Oh my gosh this girl is so brainwashed and is saying nothing of substance,2,0
47,loorfez,loojsjt,41,40.0,Until Pete came on,Or until shes unattractive to their audience.,2,0
1403,lor0wzf,,1101,,,Lol I wonder if she has an IUD and that’s why she was fumbling with her words 😅😮‍💨,0,0
992,loocafn,,730,,,"Lass, your discussion is about abstract terms like ""patriotism"", ""democrat"" and ""republican""

Disassociate from It for a sec and actually think about what is being said. This is Genuinely why modern political discourse is failing. It's so tribal, I like red you like blue so we're enemies and cannot find any common ground. God it's So hard to have a normal discussion with overly emotional irrational people..",2,0
877,lotyet8,,629,,,Here tone and way of talking to people would have to make me slap the shit out here,2,0
774,lookm9x,,534,,,I don’t think I’ve ever listened to someone say so much but so little at the same time.,0,0
1220,lopdznz,,938,,,She just wants to hear herself.,0,0
1634,lop0mzo,lond5d8,1237,1235.0,Dems burn flags,"All the MAGA and thin blue line variations of the US flag that Republicans often like to carry are a mockery of the US flag worse than burning one. 

Not to mention the ones who fly it side by side with a treasonous confederate flag. 

So go cry me a river about burning flags as a method of protesting the government.",0,0
5,lopa39m,loo0a77,5,4.0,"""if you play frame by frame, you see the exact point where [her brain] breaks!""","Logic did not, in fact, choo choo choose her",1,1
1004,loof3aq,,740,,,Calling them individualistic and socialist in the same breath lol,0,0
1555,losmypi,losmm7g,429,1213.0,"I support a woman's right to choose.  So please, tell me more about what I believe in.","Oh jeez. That's what you think I'm implying? 

Alright.. I'm done.",0,0
264,louf9r0,lomwis6,206,154.0,"Is it stolen valor if you claim your living father ""laid down his life for this country"" because he had a 30 year career in the military?  ","It doesn’t matter because he’s one person, and he’s not a lawmaker. I don’t really think of citizens as members of a party, but rather supporters of it. Like a sports team. 

The ones who get elected or nominated are members of the party, and when we speak to the actions of a party, imo that’s who we should talking about. There isn’t a single democratic lawmaker that has done the things she said, but there are plenty of lawmakers on the other side that for all intents and purposes, support the destruction of our democracy as we know it. They spew stories that they know are untrue to sow division and mistrust in our system to more easily call their followers to violence if things don’t go their way.

It’s frankly asinine to compare the behavior exhibited on either side of the aisle. They are not even in the same league when it comes to how detrimental their actions and words are to our country. These people live in a different world.",0,0
1284,lopxu7e,,999,,,Text book Gish gallop,2,0
1494,lox8pmc,,1181,,,"Conservatives hate it when conservative actions are used to enforce the opposing side of a debate. “How dare you use my words, intentions and actions against me”",0,0
444,lopye5g,lomorx4,311,269.0,Did she say anything?,No.,0,0
1003,looejt2,,739,,,"I really thought he was going to point out how she used her fathers military service as an example of patriotism, but how republicans are constantly cutting from veterans care programs.",0,0
1078,loonth3,,809,,,From someone not from the usa she just comes across sad.Somewhere somehow she just can't make the connection that she would be voting against her own interests.Problems she listed could all be solved if the will to solve them was there.,0,0
838,lopwre3,,592,,,Bla bla bla bla!,0,0
1462,lot17o6,,1151,,,"She communicates like a Faux News host. Jeesh. How are Democrats patriotic? Standing up for free speech and religion for EVERYONE not just Christians. Pushing for more and easier access to voting. Patriotism isn't symbolic gestures like the pledge of allegiance or opposing basic protected rights, like the right to protest and assemble. All the other stuff she said about ""supporting all the drugs and burning down of cities"" is just a distraction.",0,0
305,londro6,,234,,,You know she definitely has an IUD the way she kept repeating “no comment”,0,0
1274,lopurr0,,990,,,Can somebody send me the link of the entire video?,2,0
314,lonwq0d,londobo,238,237.0,"Also, when conservatives cite the number of injuries and deaths that occurred during the BLM protests as if it was something committed by their ""antifa"" boogeyman. It's like, motherfucker, do you not realize that the vast majority of injuries and deaths occurred as a result of police action AGAINST protestors- THE VERY THING THAT THESE PEOPLE WERE PROTESTING AGAINST???","Even if it were true, the protests needed to happen for the black people. They need something to help them with the injustice they go through daily. Give them the BLM moment. Even if that black lady gets in, change is still slow, so relax people. Kamala is not going to threaten the comforts of my daily life. We don’t have anything to worry about. Let them say what they want and think what they want.",0,0
150,looql04,looqgi1,28,122.0,Nah that was Trump. She was asked by the couple what she’ll do for the country since they were worried about their family. And she managed to say a lot of words and not answer one question direct.,"Cool, thanks for adding nothing to the conversation.",0,0
1149,lop5dzb,lop15ey,872,871.0,Is this kid going to just keep owning little girls? Someone send him Matt Walsh.,"There is a full form video on YouTube where he owns plenty of dumb ass grown men, there are 20 MAGA trumpets in the room 3 are women if I remember right",2,0
1214,lopd9sp,,933,,,Confident stupidity is the worst form of torture,1,0
575,lomrxa1,,371,,,She's insufferable,2,0
51,lot6dgk,lomzbaz,45,29.0,Gish gallop.,"Yup.  Trained to do it by watching Ben Shapiro and Charlie Kirk.  Just spout a fire hose of bullshit so that someone can't even pick one thing to respond to.  This guy couldn't pin her down, and he should have.

Easy way to do this: ""do you think a 10 year old rape victim should be forced to give birth?""  Do not let her talk about the life of the fetus or killing babies, that's not the question.  Keep asking until you get an answer to the question of ""do you think a 10 year old rape victim should be forced by the government to give birth?""

[Here](https://www.youtube.com/watch?v=ZOdJpv16ato)'s a really good example of this tactic in action.",2,0
1271,lopukld,,987,,,Why is this kid posted all of Reddit. We really listening to a boy in an Ed Hardy shirt debate people,0,0
727,lon4j06,lon29ql,360,492.0,"Is this for real or is it one of those mock debate sessions, where half the people have to be against something and half pro something, just for the sake of the debate, even if it doesn't allign with their true beliefs?",It was [20 Trump supporters vs the one liberal guy](https://m.youtube.com/watch?v=68aej2qmCtw) (who apparently is a professional debater),0,0
834,lopum9t,,589,,,Typical Republican. All emotion and no facts.,2,0
1116,loovqt6,,842,,,"These “debate” forum clips are weak as hell. It models what America is right now, just a bunch of dipshits screaming back and forth. Shit is JANK",2,0
1167,lop34ms,,887,,,"First of all, calm down.",0,0
471,loqzwnp,loolje1,323,230.0,Oh you should go watch the whole video. There was another lady who was even worse than her. He couldn’t even get two words out.,What is the video called? I can’t find it,0,0
972,loo93te,,712,,,She's trying so hard to be the new Candace Owens. Not the sort of person you want to look up to.,1,0
654,lonm3jf,,436,,,Does she ever shut up? Yikes!  It seems that talking over people is a cult requirement!,1,1
400,loo25pj,lomytky,280,256.0,She repeated meaningless talking points and then talked over the other kid’s attempt at a cogent response.,"This dude has so much patience. I can't even watch these whole clips when they show up, because it's so infuriating 

Idk how he manages to stay calm and give them solid answers lol",0,0
512,lop7v4q,lop4n5g,346,326.0,Is there a link to the full video? Or what is this series called?,It’s on jubilee on youtube [link](https://youtu.be/68aej2qmCtw?si=1Idhx7R5uSKvKG5Z),0,0
321,lop8ceh,loo1rql,237,241.0,"I’m not sure flipping cars and breaking into shops to steal was done by the police. I wouldn’t try to defend these protestors, they acted like animals and defamed the movement. It was not right no matter what your excuses are.","I never mentioned property damage, numbnuts, I specifically said injuries and deaths. Also, so fucking what? The BLM protests involved millions of different people, in hundreds of different states and countries, for multiple months. Anything of that size would of course result in property damage as there are always some bad actors. I mean for fucks sake, cars get turned over in the cities that won the Superbowl every year. Large groups of people result in property damage, fucking get over it.",2,0
20,loq3udy,lopk22j,10,17.0,"A truly invalid argument that makes you wanna go insane because it's like why the fuck are we even in disagreement, then? For oppression's sake, I guess.","Yes, that is exactly what they’re trying to achieve. Oppression is the American conservative’s sole platform",0,0
685,lopxm3f,looemkw,464,462.0,So annoying when people don’t allow him to speak. She’s claiming to be more patriotic? Because she’s a conservative? Egotistical.,Because her dad served in the military lol the whole family is claiming that,0,0
36,lonp7al,lomzbaz,30,29.0,Gish gallop.,"Exactly.

""I made more claims, therefore I'm right""",0,1
903,lonhaw8,,651,,,Is this a job interview to be a conservative tv host?,0,0
828,loprnng,,583,,,She’s a pizza cutter.  All edge and no point.,0,0
1467,lot6vms,,1155,,,This kid is goat,0,0
408,lonryeg,lonfjz6,286,285.0,"We all know people like these idiots in our lives, utter mouth pieces for whatever delusion of the day right wing media cooks up for them.","This type of ""debating style"" reminds me of when my 9 year old gets in a fight with her sister. She speaks as quickly as humanly possible, listing all the reasons her sister is the wrong one and she's right. No one can get a word in edge wise, and I can't understand half of what she's saying. This isn't a debate or a dialogue. It's just nonsense amounting to zero information. I have seen and heard this from folks that subscribe to both sides, and I think this filibuster bullshit is one of the biggest contributors to division in our country. If we can't actually discuss our differing views, especially when they are controversial, then we won't get anywhere.",0,0
921,lons6eg,,666,,,He looks like Tom Holland with a blonde wig.,0,0
538,lopyb1r,lonbcq5,231,353.0,"I’m assuming you didn’t listen to girl yelling at Charlie Kirk saying “She hopes his daughter gets away from him”. If you actually watch both episodes it’s very clear which group has more respect for other people and which group is more ready to run each other over to scream nonsense into a mic.

Edit: All of you downvoting my comment I dare you to watch both episodes on mute, just watch the actions of the people, how they interacted amongst themselves, then come back and tell me I’m wrong 😏","Dude this is Reddit, ain’t nobody else watching both episodes besides you and me. The Republicans will watch the Charlie Kirk episode and think all Liberals are savages who only act on emotion and try to drown out the other person. The Democrats will only watch this episode and think all Republicans are savages who only act on emotion and try to drown out the other person.

As an independent voter who watches stuff from both sides, it’s extremely painful to see how both sides accuse the other of doing the exact same shit they are doing lol",2,0
759,loo068b,,521,,,"Bruh this girl has no clarity of mind at all, she can barely even speak without correcting herself hahaha",1,0
1063,lool3u3,,796,,,She can announce words but can’t formalize a complete thought,0,0
1200,lop8zlh,,919,,,"What IF your MoM aborted YOU? 


I wish she did, next question",0,0
246,looycqm,lomwis6,190,154.0,"Is it stolen valor if you claim your living father ""laid down his life for this country"" because he had a 30 year career in the military?  ",Not to mention wtf does 30 years of his service have to do with Republicans vs Democrats. Military takes everyone basically not just one political side.,2,0
1128,looygcw,,852,,,Didn’t know Clarence Thomas had a granddaughter,0,0
785,loqeczw,loorcr0,473,223.0,What are the red flags being held up and what is this event being filmed? I don’t understand exactly what’s going on other than she seems like a raving lunatic with no real points and a refusal to have a conversation who insist on talking over dude’s attempts to engage in discussion.,"It's political tom holland (dean withers) against 20 (or 19?) trump supporters. If they want to remove the Trump supporter who's speaking, they raise a flag. If 10 flags are raised, the current Trump supporter is out, and a new one replaces him.
It's a video on jubilee. It's almost 1h40min long and there are parts that are way more annoying than this.",0,0
490,loo02t0,lomw60z,4,154.0,"Maybe if he was actually allowed to complete a sentence, he might have.","That's the whole thing that he pissed me off. He interrupted her for two seconds for clarification, apologized for interrupting, then waited patiently for her filibuster to finish, several times, and he could barely get a word in edgewood. Stfu and let him answer your damn question!",2,0
155,lonc7dl,lon5o47,126,125.0,I'm really grateful for the subtitles.,THE 👏🏼 SUBTITLES 👏🏼 SHOULD 👏🏼 HAVE 👏🏼 BEEN 👏🏼 WRITTEN 👏🏼 LIKE 👏🏼 THIS 👏🏼,0,1
962,loo6ttz,,702,,,"Imagine getting destroyed by Michael Cera's brother, Eric.",0,0
854,loreoqq,loqylkp,607,606.0,"Good god, endlessly babbling, spewing falsehoods, interrupting ad nauseum and attacking when your opposite is trying to respond is just bad debating.  It's childish and you could just see how smug she was feeling.  Like she was slam dunking and really she just looked arrogant and closed minded.  He is trying to have an honest discourse and she is too busy trying to take shote.  I love how she was completely slapped when he asked about women with IUDs.",This is just how conservatives “debate” now.,0,0
626,loo4d46,,411,,,"Jesus Christ he has more patience than Jesus fucking Christ. 

You can't reason someone out of a position they did not reason themselves into. 

Hope he's making good money from the videos. Dudes earning it to say the least.",2,0
686,loof2ap,,73,,,I’m just not sure how that lady’s face doesn’t get stuck in a permanent state of condescending mock confusion.,0,0
570,looldr3,lon6dsb,369,367.0,"She has an IUD obviously haha poor thing. Doesn't think that women should be in control of their own body yet is taking steps to ensure that she is in control of her own body. Let me clarify.. 

Her dad served in the military for 30 years, only to find out his daughter has a higher body count than he does.",Not a huge fan of the “let’s imply any woman we don’t like is a slut!” idea even if the woman in the video was dumb as hell.,2,0
1554,losmm7g,losc99x,1213,429.0,"To conservativism. To your identity. You are coming off as if he making a good point, you get mad so you ad hominem... you got nothing else.","I support a woman's right to choose.  So please, tell me more about what I believe in.",2,0
18,lopk22j,loonei1,17,15.0,"“Every accusation is a confession.” Every time a conservative bitches about something and is shown to be doing exactly that thing, they always fall back to “No comment.” Or “That’s different.”","A truly invalid argument that makes you wanna go insane because it's like why the fuck are we even in disagreement, then? For oppression's sake, I guess.",2,0
128,los2hc7,lomnr3b,111,28.0,She spoke way too much and didn’t say a damn thing.,"My father served 30 years in the, umm…………… military.",0,0
1607,loomej9,,1216,,,"The argument of an iud is ridiculous. It’s an unintended consequence, not a deliberate one.",2,0
928,lonwzdk,,673,,,Don't think she let him get out more than 2 complete sentences...,0,0
981,looau6a,,714,,,The thought process of I VOTE for a day one DICTATOR because I love PATRIOTISM is a trombone slide,2,0
1603,looentw,,1221,,,"So, she pointed out actual flaws or causes for concern towards the left party. She mentioned, burning the flag, destroying buildings, trying to remove “in God we trust” from our currency, paying respect to our country by putting your hand over your heart, NOT KNEELING, and our amendments. The very first thing that comes out of this bonehead’s mouth is trashing Trump, when he was nothing to do with the question. And if u so badly want to include him, go pull up the famous picture of him raising his fist with a bloody ear after the shooting. That’s as American as it’s gets. Democrats have completely destroyed the fundamental aspects of what made America so great. And then they go ahead and claim they are for democracy.",2,0
191,looz4ip,lon8qg6,157,156.0,"Not only that, but claiming Democrats are unpatriotic because they fight to protect people’s rights whether they agree with their decisions morally or not. So because someone else’s actions, deemed by her to be unpatriotic (getting an abortion), makes the Democratic Party unpatriotic simply by saying they have a right to make their own choice.","You're unpatriotic because you disagreed with someone who believes themselves to be patriotic. It's that simple. 

Patriotism is when nationalism becomes a religion. You are now a heretic if you question it.",0,1
1140,loozi7g,,863,,,"I agree with his points, but when I first saw this video I didn’t really think he dealt with the argument very well. Too heated and railroading over her. He’d look better if he was more cool headed. But it’s gotten so popular, I’m confused. Is the popularity just based on the ridiculousness of her opinion?

ETA: Didn't realize the setup, nvm! He's actually pretty cool-headed considering the situation.",1,0
993,loocepm,,731,,,Let. Him. Speak. Shut. Up.,2,0
1595,lonngdp,,1218,,,The sooner you peons understand that no politician will ever care about you the better off you'll be,2,0
1358,lortzdy,lor3z8n,1060,1058.0,"Sorry, but bankruptcies and not paying contractors and workers doesn’t mean he’s a bad businessman, unethical yes, but bad, no. Business is all about the bottom line and the ability to stay relevant. Yes, he’s had failed businesses but he also has generational assets and business ventures that have continued to grow. Don’t underestimate someone by looking at just the surface, he has depth of knowledge and experience running businesses.",Coming into generational wealth doesn’t mean you are a success. It just means that you inherited money.,0,0
607,lonjmz9,,394,,,"He kind of of missed the mark when she asked ""how are these actions patriotic?"" and the answer is because it protects freedoms",0,0
181,lopx7xm,lomq43g,148,123.0,Shes brutal to listen to,Karen af,2,0
